{
  "metadata": {
    "name": "menuiserie_knowledge_base",
    "version": "3.1.0",
    "language": "fr",
    "status": "normalized",
    "description": "Base de connaissances complète pour menuiserie intérieure sur mesure — bricoleurs et plus",
    "domains": [
      {
        "id": "ergonomie",
        "version": "2.0.0",
        "size_keys": 15
      },
      {
        "id": "quincaillerie",
        "version": "2.0.0",
        "size_keys": 18
      },
      {
        "id": "conception",
        "version": "2.0.0",
        "size_keys": 19
      },
      {
        "id": "projets",
        "version": "2.0.0",
        "size_keys": 17
      }
    ],
    "sources": [
      "Pratique professionnelle menuiserie (Dunod 2022)",
      "Bricozor (guides techniques charnières, coulisses)",
      "PolyBoard / Atelierbois.net (conception de meubles)",
      "Hettich, Blum, Salice (documentations techniques)",
      "Accuride, Hettich, Blum (docs techniques citées)",
      "Normes NF EN 747 (lits superposés/mezzanines)",
      "Claude (recherche web + synthèse domaines 1-3)",
      "Système 32 (norme industrielle)",
      "Blum (Clip Top, Tandembox, Aventos)",
      "Hettich (catalogues Sensys, Intermat, KA 1730, KA 290, InnoTech, ArciTech)",
      "Hafele catalogs (cited by ChatGPT)",
      "Cross-validation Gemini Pro",
      "Références métier L'Air du Bois, Mobibam, Kipli, Houzz.fr",
      "Salice (Silentia+, Logica)",
      "Normes AFNOR NF X 35-102 (ergonomie postes de travail)",
      "Cross-validation ChatGPT-4o",
      "Normes NF EN 527-1 (mobilier de bureau)",
      "Données fabricants (Lapeyre, Cuisinella, Ixina, Arthur Bonnet, MyDimm, Celio, Raison Home)",
      "Cross-validation Gemini Pro (avril 2026)",
      "Retours d'expérience L'Air du Bois",
      "L'Air du Bois (Bonbonveronbi — Pas à pas Les caissons, forums menuisiers)",
      "Würth (Tiomos, Nexis)",
      "Bricozor, Legallais, Leroy Merlin, Manomano",
      "L'Air du Bois (retours d'expérience menuisiers)",
      "Cross-validation ChatGPT-4o (avril 2026)",
      "INRS ED 923 (aménagement postes de travail)"
    ],
    "build_date": "2026-04-12",
    "stats": {
      "formules_total": 41,
      "projets_types": 17,
      "regles_transversales": 15,
      "types_meubles_ergonomie": 15,
      "sections_quincaillerie": 16,
      "sections_conception": 17
    },
    "normalization": {
      "units": "all_mm",
      "formulas": "executable_format",
      "keys": "snake_case",
      "conversion_date": "2026-04-12"
    }
  },
  "ergonomie": {
    "principes_generaux": {
      "regle_coude": "La hauteur de plan de travail idéale place le plan à 10-15 cm sous le coude fléchi à 90°",
      "zone_confort_vertical": {
        "zone_active": {
          "min_mm": 400,
          "max_mm": 1400,
          "usage": "Accès quotidien, objets fréquents"
        },
        "zone_semi_active": {
          "min_mm": 1400,
          "max_mm": 1800,
          "usage": "Penderie, objets réguliers"
        },
        "zone_passive_haute": {
          "min_mm": 1800,
          "max_mm": 2400,
          "usage": "Stockage saisonnier, objets rares"
        },
        "zone_passive_basse": {
          "min_mm": 0,
          "max_mm": 400,
          "usage": "Tiroirs, rangement lourd, chaussures"
        }
      },
      "circulations": {
        "passage_minimum_mm": 600,
        "passage_confortable_mm": 800,
        "recul_chaise_mm": {
          "min": 800,
          "max": 1000
        },
        "passage_avec_circulation_mm": {
          "min": 900,
          "max": 1200
        },
        "espace_devant_tiroir_ouvert_mm": 900,
        "espace_devant_porte_battante_mm": 1000
      },
      "portee_tablette": {
        "regle": "Portée max sans fléchissement = f(matériau, épaisseur, charge)",
        "panneau_particules_19mm_max_mm": 600,
        "mdf_19mm_max_mm": 700,
        "contreplaque_18mm_max_mm": 800,
        "bois_massif_25mm_max_mm": 900,
        "charge_max_tablette_60cm_kg": 30,
        "charge_max_tablette_80cm_kg": {
          "bois_massif": 25,
          "panneau_particules": 15
        },
        "note": "Au-delà, ajouter un support intermédiaire (séparateur vertical ou taquet renforcé)"
      }
    },
    "types_meubles": {
      "bibliotheque": {
        "description": "Meuble de rangement pour livres, objets déco, médias",
        "dimensions_globales": {
          "hauteur_basse_mm": {
            "min": 800,
            "max": 1100
          },
          "hauteur_mi_haute_mm": {
            "min": 1200,
            "max": 1500
          },
          "hauteur_standard_mm": {
            "min": 1800,
            "max": 2400
          },
          "profondeur_standard_mm": {
            "min": 250,
            "max": 350
          },
          "profondeur_beaux_livres_mm": {
            "min": 350,
            "max": 450
          },
          "largeur_module_mm": {
            "min": 300,
            "max": 1200
          },
          "espace_sous_plafond_mm": {
            "min": 50,
            "max": 100,
            "note": "Respiration visuelle"
          },
          "epaisseur_tablette_min_mm": 19,
          "epaisseur_tablette_recommandee_mm": 25
        },
        "hauteurs_entre_tablettes": {
          "livres_poche": {
            "hauteur_objet_mm": 180,
            "hauteur_tablette_mm": {
              "min": 220,
              "max": 250
            }
          },
          "romans_A5": {
            "hauteur_objet_mm": 210,
            "hauteur_tablette_mm": {
              "min": 250,
              "max": 280
            }
          },
          "BD_franco_belge": {
            "hauteur_objet_mm": 320,
            "hauteur_tablette_mm": {
              "min": 350,
              "max": 380
            }
          },
          "BD_comic_book": {
            "hauteur_objet_mm": 260,
            "hauteur_tablette_mm": {
              "min": 290,
              "max": 320
            }
          },
          "BD_manga": {
            "hauteur_objet_mm": 210,
            "hauteur_tablette_mm": {
              "min": 240,
              "max": 270
            }
          },
          "beaux_livres_art": {
            "hauteur_objet_mm": {
              "min": 300,
              "max": 400
            },
            "hauteur_tablette_mm": {
              "min": 350,
              "max": 450
            }
          },
          "classeurs": {
            "hauteur_objet_mm": 320,
            "hauteur_tablette_mm": {
              "min": 350,
              "max": 380
            }
          },
          "vinyles_33t": {
            "hauteur_objet_mm": 315,
            "hauteur_tablette_mm": {
              "min": 340,
              "max": 370
            }
          },
          "CD": {
            "hauteur_objet_mm": 125,
            "hauteur_tablette_mm": {
              "min": 150,
              "max": 180
            }
          },
          "DVD": {
            "hauteur_objet_mm": 192,
            "hauteur_tablette_mm": {
              "min": 220,
              "max": 250
            }
          },
          "deco_vases": {
            "hauteur_tablette_mm": {
              "min": 300,
              "max": 400
            }
          }
        },
        "profondeur_par_contenu": {
          "livres_poche_mm": {
            "min": 150,
            "max": 200
          },
          "romans_standard_mm": {
            "min": 220,
            "max": 280
          },
          "BD_mm": {
            "min": 250,
            "max": 300
          },
          "beaux_livres_mm": {
            "min": 300,
            "max": 450
          },
          "vinyles_mm": {
            "min": 320,
            "max": 350
          },
          "deco_mixte_mm": {
            "min": 250,
            "max": 350
          }
        },
        "regles_conception": [
          "Profondeur = largeur du plus grand objet + 2-3 cm de marge",
          "Hauteur tablette = hauteur du plus grand objet + 5-7 cm",
          "Grandes tablettes en bas, plus petites en haut (esthétique + stabilité)",
          "Portée max tablette bois massif 25mm : 90 cm ; particules 19mm : 60 cm",
          "Fixation anti-basculement obligatoire au-delà de 150 cm de hauteur",
          "Espacement passage min 90 cm devant, 105 cm si passage fréquent"
        ]
      },
      "bureau": {
        "description": "Poste de travail pour usage informatique ou administratif",
        "dimensions_standard": {
          "hauteur_plateau_mm": {
            "min": 700,
            "max": 750,
            "norme_fixe": 720,
            "ref": "NF EN 527-1"
          },
          "hauteur_assis_debout_mm": {
            "min": 650,
            "max": 1250
          },
          "profondeur_min_mm": 600,
          "profondeur_standard_mm": {
            "min": 700,
            "max": 800
          },
          "profondeur_direction_mm": {
            "min": 800,
            "max": 1000
          },
          "largeur_poste_simple_mm": {
            "min": 1200,
            "max": 1400
          },
          "largeur_double_ecran_mm": {
            "min": 1400,
            "max": 1600
          },
          "largeur_direction_mm": {
            "min": 1600,
            "max": 2000
          },
          "ecart_assise_plateau_mm": {
            "min": 200,
            "max": 260
          }
        },
        "ergonomie": {
          "distance_ecran_yeux_mm": {
            "min": 500,
            "max": 700
          },
          "position_clavier_bord_mm": {
            "min": 100,
            "max": 150,
            "note": "Distance du bord du plateau"
          },
          "recul_chaise_arriere_mm": {
            "min": 800,
            "max": 1000
          },
          "passage_lateral_mm": 600,
          "deboitement_pied_min_mm": 600,
          "hauteur_libre_sous_plateau_mm": {
            "min": 650,
            "norme_PMR": 700
          },
          "profondeur_degagement_jambes_mm": 600
        },